{
  "kind": "system_backup_schema_registry",
  "registry_version": "system-backup-schema-registry.v1",
  "contract_version": "system-backup-plan.v12",
  "contract_status": "draft",
  "plan_source": "docs/system-backup-restore-division-plan.md",
  "migration_catalog": {
    "algorithm": "sha256-length-prefixed-filename-normalized-content-v1",
    "file_count": 136,
    "hash": "dba576ad9efd3f377d8d07de2a9a86d4e523d8dafe8943751beb057a64e52441"
  },
  "schema_hash": {
    "algorithm": "sha256-information-schema-canonical-v1",
    "status": "pending_live_evidence",
    "hash": null,
    "evidence": null
  },
  "summary": {
    "object_count": 122,
    "policy_recorded": 68,
    "policy_pending": 54,
    "cross_review_pending": 68
  },
  "objects": [
    {
      "object_type": "table",
      "name": "audit_events",
      "owner": "A",
      "category": "ai_gateway",
      "data_classification": "confidential",
      "backup_strategy": "mysql_dump",
      "restore_strategy": "normalize",
      "excluded_reason": null,
      "normalizer_id": "ai_gateway.audit_events.normalize.v1",
      "verifier_id": "ai_gateway.audit_events.verify.v1",
      "depends_on": [
        "table:model_invocations",
        "table:users"
      ],
      "decision_status": "owner_recorded",
      "required_cross_reviewers": [
        "D"
      ],
      "approved_cross_reviewers": [],
      "redacted_explanation": "AI Gateway audit history is retained as redacted historical evidence; actor, invocation and request references are remapped and no event resumes execution.",
      "sources": {
        "migration": [
          "backend/internal/db/migrations/028_add_ai_gateway_runtime_attribution.sql"
        ],
        "repository_create": [],
        "repository_alter": [],
        "deployment_bootstrap": [],
        "exception": null
      }
    },
    {
      "object_type": "table",
      "name": "audit_logs",
      "owner": "D",
      "category": "resources",
      "data_classification": "confidential",
      "backup_strategy": "mysql_dump",
      "restore_strategy": "normalize",
      "excluded_reason": null,
      "normalizer_id": "resources.audit_logs.normalize.v1",
      "verifier_id": "resources.audit_logs.verify.v1",
      "depends_on": [
        "table:users"
      ],
      "decision_status": "owner_recorded",
      "required_cross_reviewers": [
        "A"
      ],
      "approved_cross_reviewers": [],
      "redacted_explanation": "Audit history is retained with redaction and actor mapping; backup-control audit cutoff is verified separately.",
      "sources": {
        "migration": [
          "backend/internal/db/migrations/001_init_schema.sql"
        ],
        "repository_create": [],
        "repository_alter": [],
        "deployment_bootstrap": [],
        "exception": null
      }
    },
    {
      "object_type": "table",
      "name": "backup_schedules",
      "owner": "B",
      "category": "instances",
      "data_classification": null,
      "backup_strategy": null,
      "restore_strategy": null,
      "excluded_reason": null,
      "normalizer_id": null,
      "verifier_id": null,
      "depends_on": [],
      "decision_status": "pending_owner_review",
      "required_cross_reviewers": [],
      "approved_cross_reviewers": [],
      "redacted_explanation": null,
      "sources": {
        "migration": [
          "backend/internal/db/migrations/001_init_schema.sql"
        ],
        "repository_create": [],
        "repository_alter": [],
        "deployment_bootstrap": [],
        "exception": null
      }
    },
    {
      "object_type": "table",
      "name": "backups",
      "owner": "B",
      "category": "instances",
      "data_classification": null,
      "backup_strategy": null,
      "restore_strategy": null,
      "excluded_reason": null,
      "normalizer_id": null,
      "verifier_id": null,
      "depends_on": [],
      "decision_status": "pending_owner_review",
      "required_cross_reviewers": [],
      "approved_cross_reviewers": [],
      "redacted_explanation": null,
      "sources": {
        "migration": [
          "backend/internal/db/migrations/001_init_schema.sql"
        ],
        "repository_create": [],
        "repository_alter": [],
        "deployment_bootstrap": [],
        "exception": null
      }
    },
    {
      "object_type": "table",
      "name": "chat_messages",
      "owner": "A",
      "category": "ai_gateway",
      "data_classification": "confidential",
      "backup_strategy": "mysql_dump",
      "restore_strategy": "normalize",
      "excluded_reason": null,
      "normalizer_id": "ai_gateway.chat_messages.normalize.v1",
      "verifier_id": "ai_gateway.chat_messages.verify.v1",
      "depends_on": [
        "table:chat_sessions",
        "table:instances",
        "table:model_invocations",
        "table:users"
      ],
      "decision_status": "owner_recorded",
      "required_cross_reviewers": [
        "D"
      ],
      "approved_cross_reviewers": [],
      "redacted_explanation": "Chat content is confidential historical data. Restore remaps session, actor, instance and invocation references and never restores a live conversation cursor.",
      "sources": {
        "migration": [
          "backend/internal/db/migrations/079_add_a_owned_chat_and_risk_tables.sql"
        ],
        "repository_create": [],
        "repository_alter": [],
        "deployment_bootstrap": [],
        "exception": null
      }
    },
    {
      "object_type": "table",
      "name": "chat_sessions",
      "owner": "A",
      "category": "ai_gateway",
      "data_classification": "confidential",
      "backup_strategy": "mysql_dump",
      "restore_strategy": "normalize",
      "excluded_reason": null,
      "normalizer_id": "ai_gateway.chat_sessions.normalize.v1",
      "verifier_id": "ai_gateway.chat_sessions.verify.v1",
      "depends_on": [
        "table:instances",
        "table:users"
      ],
      "decision_status": "owner_recorded",
      "required_cross_reviewers": [
        "D"
      ],
      "approved_cross_reviewers": [],
      "redacted_explanation": "Chat sessions are restored as historical session metadata with target user and instance mapping; session activity is not resumed automatically.",
      "sources": {
        "migration": [
          "backend/internal/db/migrations/079_add_a_owned_chat_and_risk_tables.sql"
        ],
        "repository_create": [],
        "repository_alter": [],
        "deployment_bootstrap": [],
        "exception": null
      }
    },
    {
      "object_type": "table",
      "name": "cost_records",
      "owner": "A",
      "category": "ai_gateway",
      "data_classification": "confidential",
      "backup_strategy": "mysql_dump",
      "restore_strategy": "normalize",
      "excluded_reason": null,
      "normalizer_id": "ai_gateway.cost_records.normalize.v1",
      "verifier_id": "ai_gateway.cost_records.verify.v1",
      "depends_on": [
        "table:llm_models",
        "table:model_invocations",
        "table:users"
      ],
      "decision_status": "owner_recorded",
      "required_cross_reviewers": [
        "D"
      ],
      "approved_cross_reviewers": [],
      "redacted_explanation": "Cost records are immutable accounting history; target identifiers are remapped and monetary/token aggregates are verified without replaying provider calls.",
      "sources": {
        "migration": [
          "backend/internal/db/migrations/028_add_ai_gateway_runtime_attribution.sql"
        ],
        "repository_create": [],
        "repository_alter": [],
        "deployment_bootstrap": [],
        "exception": null
      }
    },
    {
      "object_type": "table",
      "name": "custom_team_templates",
      "owner": "C",
      "category": "teams",
      "data_classification": null,
      "backup_strategy": null,
      "restore_strategy": null,
      "excluded_reason": null,
      "normalizer_id": null,
      "verifier_id": null,
      "depends_on": [],
      "decision_status": "pending_owner_review",
      "required_cross_reviewers": [],
      "approved_cross_reviewers": [],
      "redacted_explanation": null,
      "sources": {
        "migration": [
          "backend/internal/db/migrations/046_add_custom_team_templates.sql"
        ],
        "repository_create": [],
        "repository_alter": [],
        "deployment_bootstrap": [],
        "exception": null
      }
    },
    {
      "object_type": "table",
      "name": "egress_private_exceptions",
      "owner": "D",
      "category": "resources",
      "data_classification": "confidential",
      "backup_strategy": "mysql_dump",
      "restore_strategy": "normalize",
      "excluded_reason": null,
      "normalizer_id": "resources.egress_private_exceptions.normalize.v1",
      "verifier_id": "resources.egress_private_exceptions.verify.v1",
      "depends_on": [
        "table:instances",
        "table:users"
      ],
      "decision_status": "owner_recorded",
      "required_cross_reviewers": [
        "A",
        "B"
      ],
      "approved_cross_reviewers": [],
      "redacted_explanation": "User and instance references require target mapping; destination policy must be revalidated.",
      "sources": {
        "migration": [
          "backend/internal/db/migrations/044_add_egress_private_exceptions.sql"
        ],
        "repository_create": [],
        "repository_alter": [],
        "deployment_bootstrap": [],
        "exception": null
      }
    },
    {
      "object_type": "table",
      "name": "enterprise_auth_settings",
      "owner": "A",
      "category": "users",
      "data_classification": "secret",
      "backup_strategy": "mysql_dump",
      "restore_strategy": "normalize",
      "excluded_reason": null,
      "normalizer_id": "users.enterprise_auth_settings.normalize.v1",
      "verifier_id": "users.enterprise_auth_settings.verify.v1",
      "depends_on": [
        "table:users"
      ],
      "decision_status": "owner_recorded",